{
  "schema_version": 1,
  "workflow_name": "legacy-run",
  "output_dir": "<output-dir>",
  "manifest_version": 0,
  "mode": "",
  "attempt": 0,
  "status": "failed",
  "runtime_state": "incomplete",
  "resumable": false,
  "resume_error": "cannot resume: manifest has no manifest_version (legacy format); run a fresh workflow instead",
  "workflow_summary": {
    "findings": [],
    "recommendations": [],
    "warnings": []
  },
  "steps": []
}
