{
  "schema_version": 1,
  "workflow_name": "multi-window-test",
  "output_dir": "<output-dir>",
  "manifest_version": 2,
  "mode": "run",
  "attempt": 1,
  "status": "success",
  "runtime_state": "complete",
  "resumable": true,
  "resume_error": "",
  "workflow_summary": {
    "findings": [
      {
        "kind": "comparability_guard",
        "title": "Comparability guard",
        "summary": "Causal findings suppressed because input comparability is unknown; raw deltas remain available.",
        "source_step_kind": "compare",
        "source_step_name": "week2_vs_week1",
        "source_report_path": "compare/week2_vs_week1.html",
        "source_report_label": "week2_vs_week1"
      }
    ],
    "recommendations": [],
    "warnings": []
  },
  "steps": [
    {
      "kind": "analyze",
      "name": "week1",
      "status": "success",
      "execution": "executed",
      "artifacts": [
        {
          "path": "analyze/week1.json",
          "exists": true
        }
      ]
    },
    {
      "kind": "analyze",
      "name": "week2",
      "status": "success",
      "execution": "executed",
      "artifacts": [
        {
          "path": "analyze/week2.json",
          "exists": true
        }
      ]
    },
    {
      "kind": "compare",
      "name": "week2_vs_week1",
      "status": "success",
      "execution": "executed",
      "artifacts": [
        {
          "path": "compare/week2_vs_week1.json",
          "exists": true
        },
        {
          "path": "compare/week2_vs_week1.html",
          "exists": true
        }
      ]
    },
    {
      "kind": "trend",
      "name": "weekly_series",
      "status": "success",
      "execution": "executed",
      "artifacts": [
        {
          "path": "trend/weekly_series.json",
          "exists": true
        },
        {
          "path": "trend/weekly_series.html",
          "exists": true
        }
      ]
    }
  ],
  "resume_preview": [
    {
      "kind": "analyze",
      "name": "week1",
      "action": "reuse",
      "reason": "reused: prior success with intact artifacts"
    },
    {
      "kind": "analyze",
      "name": "week2",
      "action": "reuse",
      "reason": "reused: prior success with intact artifacts"
    },
    {
      "kind": "compare",
      "name": "week2_vs_week1",
      "action": "reuse",
      "reason": "reused: prior success with intact artifacts"
    },
    {
      "kind": "trend",
      "name": "weekly_series",
      "action": "reuse",
      "reason": "reused: prior success with intact artifacts"
    }
  ]
}
